{
  "$schema": "http://json-schema.org/draft-07/schema#",
  "$id": "https://scribe.engine/config.schema.json",
  "title": "Scribe Engine Configuration Schema",
  "description": "JSON Schema for validating Scribe engine configuration files",
  "type": "object",
  "required": ["config_version", "engine_settings", "security", "rules"],
  "additionalProperties": false,
  "properties": {
    "config_version": {
      "type": "string",
      "pattern": "^\\d+\\.\\d+$",
      "description": "Configuration schema version (e.g., '1.0')"
    },
    "engine_settings": {
      "type": "object",
      "required": ["log_level", "quarantine_path", "pause_file"],
      "additionalProperties": false,
      "properties": {
        "log_level": {
          "type": "string",
          "enum": ["DEBUG", "INFO", "WARNING", "ERROR", "CRITICAL"],
          "description": "Logging level for the engine"
        },
        "quarantine_path": {
          "type": "string",
          "minLength": 1,
          "description": "Directory path for quarantining problematic files"
        },
        "pause_file": {
          "type": "string",
          "minLength": 1,
          "description": "File that pauses engine operation when present"
        }
      }
    },
    "security": {
      "type": "object",
      "required": ["allowed_commands", "restricted_paths"],
      "additionalProperties": false,
      "properties": {
        "allowed_commands": {
          "type": "array",
          "items": {
            "type": "string",
            "minLength": 1
          },
          "uniqueItems": true,
          "description": "List of allowed executable commands"
        },
        "restricted_paths": {
          "type": "array",
          "items": {
            "type": "string",
            "minLength": 1
          },
          "uniqueItems": true,
          "description": "List of paths that are restricted from processing"
        }
      }
    },
    "rules": {
      "type": "array",
      "items": {
        "$ref": "#/definitions/rule"
      },
      "description": "List of processing rules"
    }
  },
  "definitions": {
    "rule": {
      "type": "object",
      "required": ["id", "name", "enabled", "file_glob", "trigger_pattern", "actions"],
      "additionalProperties": false,
      "properties": {
        "id": {
          "type": "string",
          "pattern": "^RULE-\\d{3}$",
          "description": "Unique rule identifier (format: RULE-XXX)"
        },
        "name": {
          "type": "string",
          "minLength": 1,
          "maxLength": 100,
          "description": "Human-readable rule name"
        },
        "enabled": {
          "type": "boolean",
          "description": "Whether the rule is active"
        },
        "file_glob": {
          "type": "string",
          "minLength": 1,
          "description": "File pattern to match (glob syntax)"
        },
        "trigger_pattern": {
          "type": "string",
          "minLength": 1,
          "description": "Regular expression pattern to trigger the rule"
        },
        "actions": {
          "type": "array",
          "minItems": 1,
          "items": {
            "$ref": "#/definitions/action"
          },
          "description": "List of actions to execute when rule triggers"
        },
        "error_handling": {
          "type": "object",
          "additionalProperties": false,
          "properties": {
            "circuit_breaker": {
              "$ref": "#/definitions/circuit_breaker"
            }
          },
          "description": "Error handling configuration for the rule"
        }
      }
    },
    "action": {
      "type": "object",
      "required": ["type", "params"],
      "additionalProperties": false,
      "properties": {
        "type": {
          "type": "string",
          "minLength": 1,
          "description": "Action type identifier"
        },
        "params": {
          "type": "object",
          "description": "Action-specific parameters"
        }
      }
    },
    "circuit_breaker": {
      "type": "object",
      "required": ["failure_threshold", "recovery_timeout_seconds"],
      "additionalProperties": false,
      "properties": {
        "failure_threshold": {
          "type": "integer",
          "minimum": 1,
          "maximum": 100,
          "description": "Number of failures before circuit opens"
        },
        "recovery_timeout_seconds": {
          "type": "integer",
          "minimum": 1,
          "maximum": 3600,
          "description": "Seconds to wait before attempting recovery"
        }
      }
    }
  }
} 